{"format": "clementina-overlay", "version": 1, "id": "overlay:hud", "name": "Hud", "tilesetId": "tileset:player", "altTilesetId": "tileset:player", "cells": [{"tile": 0, "paletteBank": 0, "flipX": false, "flipY": false, "priority": false, "chrAlt": false}, {"tile": 0, "paletteBank": 0, "flipX": false, "flipY": false, "priority": false, "chrAlt": false}, {"tile": 0, "paletteBank": 0, "flipX": false, "flipY": false, "priority": false, "chrAlt": false}, {"tile": 0, "paletteBank": 0, "flipX": false, "flipY": false, "priority": false, "chrAlt": false}, {"tile": 0, "paletteBank": 0, "flipX": false, "flipY": false, "priority": false, "chrAlt": false}, {"tile": 0, "paletteBank": 0, "flipX": false, "flipY": false, "priority": false, "chrAlt": false}, {"tile": 0, "paletteBank": 0, "flipX": false, "flipY": false, "priority": false, "chrAlt": false}, {"tile": 0, "paletteBank": 0, "flipX": false, "flipY": false, "priority": false, "chrAlt": false}, {"tile": 0, "paletteBank": 0, "flipX": false, "flipY": false, "priority": false, "chrAlt": false}, {"tile": 0, "paletteBank": 0, "flipX": false, "flipY": false, "priority": false, "chrAlt": false}, {"tile": 0, "paletteBank": 0, "flipX": false, "flipY": false, "priority": false, "chrAlt": false}, {"tile": 0, "paletteBank": 0, "flipX": false, "flipY": false, "priority": false, "chrAlt": false}, {"tile": 0, "paletteBank": 0, "flipX": false, "flipY": false, "priority": false, "chrAlt": false}, {"tile": 0, "paletteBank": 0, "flipX": false, "flipY": false, "priority": false, "chrAlt": false}, {"tile": 0, "paletteBank": 0, "flipX": false, "flipY": false, "priority": false, "chrAlt": false}, {"tile": 0, "paletteBank": 0, "flipX": false, "flipY": false, "priority": false, "chrAlt": false}, {"tile": 0, "paletteBank": 0, "flipX": false, "flipY": false, "priority": false, "chrAlt": false}, {"tile": 0, "paletteBank": 0, "flipX": false, "flipY": false, "priority": false, "chrAlt": false}, {"tile": 0, "paletteBank": 0, "flipX": false, "flipY": false, "priority": false, "chrAlt": false}, {"tile": 0, "paletteBank": 0, "flipX": false, "flipY": false, "priority": false, "chrAlt": false}, {"tile": 0, "paletteBank": 0, "flipX": false, "flipY": false, "priority": false, "chrAlt": false}, {"tile": 0, "paletteBank": 0, "flipX": false, "flipY": false, "priority": false, "chrAlt": false}, {"tile": 0, "paletteBank": 0, "flipX": false, "flipY": false, "priority": false, "chrAlt": false}, {"tile": 0, "paletteBank": 0, "flipX": false, "flipY": false, "priority": false, "chrAlt": false}, {"tile": 0, "paletteBank": 0, "flipX": false, "flipY": false, "priority": false, "chrAlt": false}, {"tile": 0, "paletteBank": 0, "flipX": false, "flipY": false, "priority": false, "chrAlt": false}, {"tile": 0, "paletteBank": 0, "flipX": false, "flipY": false, "priority": false, "chrAlt": false}, {"tile": 0, "paletteBank": 0, "flipX": false, "flipY": false, "priority": false, "chrAlt": false}, {"tile": 0, "paletteBank": 0, "flipX": false, "flipY": false, "priority": false, "chrAlt": false}, {"tile": 0, "paletteBank": 0, "flipX": false, "flipY": false, "priority": false, "chrAlt": false}, {"tile": 0, "paletteBank": 0, "flipX": false, "flipY": false, "priority": false, "chrAlt": false}, {"tile": 0, "paletteBank": 0, "flipX": false, "flipY": false, "priority": false, "chrAlt": false}, {"tile": 0, "paletteBank": 0, "flipX": false, "flipY": false, "priority": false, "chrAlt": false}, {"tile": 0, "paletteBank": 0, "flipX": false, "flipY": false, "priority": false, "chrAlt": false}, {"tile": 0, "paletteBank": 0, "flipX": false, "flipY": false, "priority": false, "chrAlt": false}, {"tile": 0, "paletteBank": 0, "flipX": false, "flipY": false, "priority": false, "chrAlt": false}, {"tile": 0, "paletteBank": 0, "flipX": false, "flipY": false, "priority": false, "chrAlt": false}, {"tile": 0, "paletteBank": 0, "flipX": false, "flipY": false, "priority": false, "chrAlt": false}, {"tile": 0, "paletteBank": 0, "flipX": false, "flipY": false, "priority": false, "chrAlt": false}, {"tile": 0, "paletteBank": 0, "flipX": false, "flipY": false, "priority": false, "chrAlt": false}, {"tile": 0, "paletteBank": 0, "flipX": false, "flipY": false, "priority": false, "chrAlt": false}, {"tile": 0, "paletteBank": 0, "flipX": false, "flipY": false, "priority": false, "chrAlt": false}, {"tile": 0, "paletteBank": 0, "flipX": false, "flipY": false, "priority": false, "chrAlt": false}, {"tile": 0, "paletteBank": 0, "flipX": false, "flipY": false, "priority": false, "chrAlt": false}, {"tile": 0, "paletteBank": 0, "flipX": false, "flipY": false, "priority": false, "chrAlt": false}, {"tile": 0, "paletteBank": 0, "flipX": false, "flipY": false, "priority": false, "chrAlt": false}, {"tile": 0, "paletteBank": 0, "flipX": false, "flipY": false, "priority": false, "chrAlt": false}, {"tile": 0, "paletteBank": 0, "flipX": false, "flipY": false, "priority": false, "chrAlt": false}, {"tile": 0, "paletteBank": 0, "flipX": false, "flipY": false, "priority": false, "chrAlt": false}, {"tile": 0, "paletteBank": 0, "flipX": false, "flipY": false, "priority": false, "chrAlt": false}, {"tile": 0, "paletteBank": 0, "flipX": false, "flipY": false, "priority": false, "chrAlt": false}, {"tile": 0, "paletteBank": 0, "flipX": false, "flipY": false, "priority": false, "chrAlt": false}, {"tile": 0, "paletteBank": 0, "flipX": false, "flipY": false, "priority": false, "chrAlt": false}, {"tile": 0, "paletteBank": 0, "flipX": false, "flipY": false, "priority": false, "chrAlt": false}, {"tile": 0, "paletteBank": 0, "flipX": false, "flipY": false, "priority": false, "chrAlt": false}, {"tile": 0, "paletteBank": 0, "flipX": false, "flipY": false, "priority": false, "chrAlt": false}, {"tile": 0, "paletteBank": 0, "flipX": false, "flipY": false, "priority": false, "chrAlt": false}, {"tile": 0, "paletteBank": 0, "flipX": false, "flipY": false, "priority": false, "chrAlt": false}, {"tile": 0, "paletteBank": 0, "flipX": false, "flipY": false, "priority": false, "chrAlt": false}, {"tile": 0, "paletteBank": 0, "flipX": false, "flipY": false, "priority": false, "chrAlt": false}, {"tile": 0, "paletteBank": 0, "flipX": false, "flipY": false, "priority": false, "chrAlt": false}, {"tile": 0, "paletteBank": 0, "flipX": false, "flipY": false, "priority": false, "chrAlt": false}, {"tile": 0, "paletteBank": 0, "flipX": false, "flipY": false, "priority": false, "chrAlt": false}, {"tile": 0, "paletteBank": 0, "flipX": false, "flipY": false, "priority": false, "chrAlt": false}, {"tile": 0, "paletteBank": 0, "flipX": false, "flipY": false, "priority": false, "chrAlt": false}, {"tile": 0, "paletteBank": 0, "flipX": false, "flipY": false, "priority": false, "chrAlt": false}, {"tile": 0, "paletteBank": 0, "flipX": false, "flipY": false, "priority": false, "chrAlt": false}, {"tile": 0, "paletteBank": 0, "flipX": false, "flipY": false, "priority": false, "chrAlt": false}, {"tile": 0, "paletteBank": 0, "flipX": false, "flipY": false, "priority": false, "chrAlt": false}, {"tile": 0, "paletteBank": 0, "flipX": false, "flipY": false, "priority": false, "chrAlt": false}, {"tile": 0, "paletteBank": 0, "flipX": false, "flipY": false, "priority": false, "chrAlt": false}, {"tile": 0, "paletteBank": 0, "flipX": false, "flipY": false, "priority": false, "chrAlt": false}, {"tile": 0, "paletteBank": 0, "flipX": false, "flipY": false, "priority": false, "chrAlt": false}, {"tile": 0, "paletteBank": 0, "flipX": false, "flipY": false, "priority": false, "chrAlt": false}, {"tile": 0, "paletteBank": 0, "flipX": false, "flipY": false, "priority": false, "chrAlt": false}, {"tile": 0, "paletteBank": 0, "flipX": false, "flipY": false, "priority": false, "chrAlt": false}, {"tile": 0, "paletteBank": 0, "flipX": false, "flipY": false, "priority": false, "chrAlt": false}, {"tile": 0, "paletteBank": 0, "flipX": false, "flipY": false, "priority": false, "chrAlt": false}, {"tile": 0, "paletteBank": 0, "flipX": false, "flipY": false, "priority": false, "chrAlt": false}, {"tile": 0, "paletteBank": 0, "flipX": false, "flipY": false, "priority": false, "chrAlt": false}, {"tile": 0, "paletteBank": 0, "flipX": false, "flipY": false, "priority": false, "chrAlt": false}, {"tile": 0, "paletteBank": 0, "flipX": false, "flipY": false, "priority": false, "chrAlt": false}, {"tile": 0, "paletteBank": 0, "flipX": false, "flipY": false, "priority": false, "chrAlt": false}, {"tile": 0, "paletteBank": 0, "flipX": false, "flipY": false, "priority": false, "chrAlt": false}, {"tile": 0, "paletteBank": 0, "flipX": false, "flipY": false, "priority": false, "chrAlt": false}, {"tile": 0, "paletteBank": 0, "flipX": false, "flipY": false, "priority": false, "chrAlt": false}, {"tile": 0, "paletteBank": 0, "flipX": false, "flipY": false, "priority": false, "chrAlt": false}, {"tile": 0, "paletteBank": 0, "flipX": false, "flipY": false, "priority": false, "chrAlt": false}, {"tile": 0, "paletteBank": 0, "flipX": false, "flipY": false, "priority": false, "chrAlt": false}, {"tile": 0, "paletteBank": 0, "flipX": false, "flipY": false, "priority": false, "chrAlt": false}, {"tile": 0, "paletteBank": 0, "flipX": false, "flipY": false, "priority": false, "chrAlt": false}, {"tile": 0, "paletteBank": 0, "flipX": false, "flipY": false, "priority": false, "chrAlt": false}, {"tile": 0, "paletteBank": 0, "flipX": false, "flipY": false, "priority": false, "chrAlt": false}, {"tile": 0, "paletteBank": 0, "flipX": false, "flipY": false, "priority": false, "chrAlt": false}, {"tile": 0, "paletteBank": 0, "flipX": false, "flipY": false, "priority": false, "chrAlt": false}, {"tile": 0, "paletteBank": 0, "flipX": false, "flipY": false, "priority": false, "chrAlt": false}, {"tile": 0, "paletteBank": 0, "flipX": false, "flipY": false, "priority": false, "chrAlt": false}, {"tile": 0, "paletteBank": 0, "flipX": false, "flipY": false, "priority": false, "chrAlt": false}, {"tile": 0, "paletteBank": 0, "flipX": false, "flipY": false, "priority": false, "chrAlt": false}, {"tile": 0, "paletteBank": 0, "flipX": fa